2. DML COMMANDS 
 a) DML -INSERT


mysql> use amitha;
Database changed

//1,INSERT VALUES IN EMPLOYEE TABLE

mysql> insert into EMPLOYEE values(1,"AMITHA","NILAMBUR",'2005-02-02',920723147111),(2,"DHRISHYA","PALAKKAD",'2003-07-17',949523147111),(3,"LAKSHMI","PALAKKAD",'2003-07-17',994618617411);
Query OK, 1 row affected (0.00 sec)


mysql> select *from EMPLOYEE;
+------+----------+----------+------------+--------------+
| SSN  | NAME     | CITY     | DOB        | AADHAR_NO    |
+------+----------+----------+------------+--------------+
|    1 | AMITHA   | NILAMBUR | 2005-02-02 | 920723147111 |
|    2 | DHRISHYA | PALAKKAD | 2003-07-17 | 949523147111 |
|    3 | LAKSHMI  | PALAKKAD | 2003-07-17 | 994618617411 |
+------+----------+----------+------------+--------------+
3 rows in set (0.00 sec)

//2.insert values in STUDENT table

mysql> insert into STUDENT values(1,"AMITHA",21,"KOLAKKATTIL","F"),(2,"DHRISHYA",22,"AALATTUR","F"),(3,"IHSAN",22,"MUKKAM","M");
Query OK, 3 rows affected (0.01 sec)
Records: 3  Duplicates: 0  Warnings: 0

mysql> select *from STUDENT;
+---------+----------+------+-------------+--------+
| ROLL_NO | NAME     | AGE  | ADDRESS     | GENDER |
+---------+----------+------+-------------+--------+
|       1 | AMITHA   |   21 | KOLAKKATTIL | F      |
|       2 | DHRISHYA |   22 | AALATTUR    | F      |
|       3 | IHSAN    |   22 | MUKKAM      | M      |
+---------+----------+------+-------------+--------+
3 rows in set (0.00 sec)


//3. Insert values in INVOICE database. 

mysql> use INVOICE;
Database changed

mysql>insert into CUSTOMER values(1,"AMITHA","KOLAKKAD","MALAPPURAM",NULL),(2,"DHRISHYA","KOLAKKATTIL","TVM",NULL),(3,"LAKSHMI","AALATTUR","PALAKKAD",9774574722),(4,"MANISHA","KOLAKKATTIL","TVM",9207231471),(5,"SHAIKHA","NARIPOYIL","MALAPPURAM",9456574722),(6,"NEFLA","KOLAKKATTIL","WAYANAD",9207418571),(7,"ANU","KARULAYI","MALAPPURAM",9123654722);

mysql> select * from CUSTOMER;
+---------+----------+-------------+------------+------------+
| CUST_ID | NAME     | ADDRESS     | CITY       | PH_NO      |
+---------+----------+-------------+------------+------------+
|       1 | AMITHA   | KOLAKKAD    | MALAPPURAM | NULL       |
|       2 | DHRISHYA | KOLAKKATTIL | TVM        | NULL       |
|       3 | LAKSHMI  | AALATTUR    | PALAKKAD   | 9774574722 |
|       4 | MANISHA  | KOLAKKATTIL | TVM        | 9207231471 |
|       5 | SHAIKHA  | NARIPOYIL   | MALAPPURAM | 9456574722 |
|       6 | NEFLA    | KOLAKKATTIL | WAYANAD    | 9207418571 |
|       7 | ANU      | KARULAYI    | MALAPPURAM | 9123654722 |
+---------+----------+-------------+------------+------------+
7 rows in set (0.00 sec)



mysql> insert into PRODUCT values(101,"CAKE",300),(102,"CUP",20),(103,"BOOKS",722),(104,"PHONE",31471),(105,"MILK",22),(106,"OATS",571),(107,"PEN",12);
Query OK, 


mysql> select * from PRODUCT;
+------+-------+-------+
| P_ID | PNAME | PRICE |
+------+-------+-------+
|  101 | CAKE  |   300 |
|  102 | CUP   |    20 |
|  103 | BOOKS |   722 |
|  104 | PHONE | 31471 |
|  105 | MILK  |    22 |
|  106 | OATS  |   571 |
|  107 | PEN   |    12 |
+------+-------+-------+
7 rows in set (0.00 sec)


mysql> insert into INVOICE_MASTER values(200,1,'2025-02-03'),(201,1,'2025-05-25'),(202,2,'2025-12-07'),(203,2,'2025-06-24'),(204,3,'2025-12-27'),(205,4,'2025-2-24'),(206,3,'2025-10-07'),(207,2,'2025-12-24');
Query OK, 

mysql> insert into INVOICE_MASTER values(208,5,'2025-05-07'),(209,6,'2025-06-24');
Query OK, 2 rows affected (0.00 sec)
Records: 2  Duplicates: 0  Warnings: 0

mysql> insert into INVOICE_MASTER values(210,7,'2025-05-02'),(211,6,'2025-02-02');
Query OK, 2 rows affected (0.01 sec)
Records: 2  Duplicates: 0  Warnings: 0

mysql> insert into INVOICE_MASTER values(212,1,'2025-06-02');
Query OK, 1 row affected (0.00 sec)

mysql> select * from INVOICE_MASTER;
+--------+---------+------------+
| INV_ID | CUST_ID | INV_DATE   |
+--------+---------+------------+
|    200 |       1 | 2025-02-03 |
|    201 |       1 | 2025-05-25 |
|    202 |       2 | 2025-12-07 |
|    203 |       2 | 2025-06-24 |
|    204 |       3 | 2025-12-27 |
|    205 |       4 | 2025-02-24 |
|    206 |       3 | 2025-10-07 |
|    207 |       2 | 2025-12-24 |
|    208 |       5 | 2025-05-07 |
|    209 |       6 | 2025-06-24 |
|    210 |       7 | 2025-05-02 |
|    211 |       6 | 2025-02-02 |
|    212 |       1 | 2025-06-02 |
+--------+---------+------------+
13 rows in set (0.00 sec)

mysql> insert into INVOICE_ITEM values(202,102,2),(203,102,5);
Query OK, 2 rows affected (0.00 sec)
Records: 2  Duplicates: 0  Warnings: 0

mysql> insert into INVOICE_ITEM values(204,103,1),(205,104,3);
Query OK, 2 rows affected (0.01 sec)
Records: 2  Duplicates: 0  Warnings: 0

mysql> insert into INVOICE_ITEM values(206,103,1),(207,102,4);
Query OK, 2 rows affected (0.00 sec)
Records: 2  Duplicates: 0  Warnings: 0

mysql> insert into INVOICE_ITEM values(208,105,7),(209,102,4);
Query OK, 2 rows affected (0.00 sec)
Records: 2  Duplicates: 0  Warnings: 

mysql> insert into INVOICE_ITEM values(210,107,2),(211,106,2),(212,107,6),(201,107,2),(201,106,5),(202,102,1),(202,104,2),(201,103,2),(202,106,4);
Query Ok,

mysql> select * from INVOICE_ITEM;
+--------+------+---------+
| INV_ID | P_ID | QUALITY |
+--------+------+---------+
|    202 |  102 |       2 |
|    203 |  102 |       5 |
|    204 |  103 |       1 |
|    205 |  104 |       3 |
|    206 |  103 |       1 |
|    207 |  102 |       4 |
|    208 |  105 |       7 |
|    209 |  102 |       4 |
|    210 |  107 |       2 |
|    211 |  106 |       2 |
|    212 |  107 |       6 |
|    201 |  107 |       2 |
|    201 |  106 |       5 |
|    202 |  102 |       1 |
|    202 |  104 |       2 |
|    201 |  103 |       2 |
|    202 |  106 |       4 |
+--------+------+---------+
17 rows in set (0.00 sec)

mysql> 

 b) DML - UPDATE 
// 1. Update the price of a particular product. 

mysql> UPDATE PRODUCT SET PRICE=40000 WHERE P_ID=104;
Query OK, 1 row affected (0.00 sec)
Rows matched: 1  Changed: 1  Warnings: 0

mysql> SELECT * FROM PRODUCT;
+------+-------+-------+
| P_ID | PNAME | PRICE |
+------+-------+-------+
|  101 | CAKE  |   300 |
|  102 | CUP   |    20 |
|  103 | BOOKS |   722 |
|  104 | PHONE | 40000 |
|  105 | MILK  |    22 |
|  106 | OATS  |   571 |
|  107 | PEN   |    12 |
+------+-------+-------+
7 rows in set (0.00 sec)

// 2. Change the name of city ‘malappuram’ to ‘kozhikode’ in the customer table. 

mysql> UPDATE CUSTOMER SET CITY="KOZHIKODE" WHERE CUST_ID=1;
Query OK, 1 row affected (0.00 sec)
Rows matched: 1  Changed: 1  Warnings: 0

mysql> SELECT * FROM CUSTOMER;
+---------+----------+-------------+------------+------------+
| CUST_ID | NAME     | ADDRESS     | CITY       | PH_NO      |
+---------+----------+-------------+------------+------------+
|       1 | AMITHA   | KOLAKKAD    | KOZHIKODE  | NULL       |
|       2 | DHRISHYA | KOLAKKATTIL | TVM        | NULL       |
|       3 | LAKSHMI  | AALATTUR    | PALAKKAD   | 9774574722 |
|       4 | MANISHA  | KOLAKKATTIL | TVM        | 9207231471 |
|       5 | SHAIKHA  | NARIPOYIL   | MALAPPURAM | 9456574722 |
|       6 | NEFLA    | KOLAKKATTIL | WAYANAD    | 9207418571 |
|       7 | ANU      | KARULAYI    | MALAPPURAM | 9123654722 |
+---------+----------+-------------+------------+------------+
7 rows in set (0.00 sec)

//3. Update all prices with 2% of its original price. 

mysql> UPDATE PRODUCT SET PRICE=PRICE*1.02;
Query OK, 4 rows affected, 5 warnings (0.01 sec)
Rows matched: 7  Changed: 4  Warnings: 5

mysql> SELECT * FROM PRODUCT;
+------+-------+-------+
| P_ID | PNAME | PRICE |
+------+-------+-------+
|  101 | CAKE  |   306 |
|  102 | CUP   |    20 |
|  103 | BOOKS |   736 |
|  104 | PHONE | 40800 |
|  105 | MILK  |    22 |
|  106 | OATS  |   582 |
|  107 | PEN   |    12 |
+------+-------+-------+
7 rows in set (0.00 sec)

// 4. Change the address, city, phone number of a particular customer. 

mysql> UPDATE CUSTOMER SET CITY="TVM",PH_NO=9207231471,ADDRESS="NILAMBUR" WHERE CUST_ID=1;
Query OK, 1 row affected (0.00 sec)
Rows matched: 1  Changed: 1  Warnings: 0

mysql> SELECT * FROM CUSTOMER;
+---------+----------+-------------+------------+------------+
| CUST_ID | NAME     | ADDRESS     | CITY       | PH_NO      |
+---------+----------+-------------+------------+------------+
|       1 | AMITHA   | NILAMBUR    | TVM        | 9207231471 |
|       2 | DHRISHYA | KOLAKKATTIL | TVM        | NULL       |
|       3 | LAKSHMI  | AALATTUR    | PALAKKAD   | 9774574722 |
|       4 | MANISHA  | KOLAKKATTIL | TVM        | 9207231471 |
|       5 | SHAIKHA  | NARIPOYIL   | MALAPPURAM | 9456574722 |
|       6 | NEFLA    | KOLAKKATTIL | WAYANAD    | 9207418571 |
|       7 | ANU      | KARULAYI    | MALAPPURAM | 9123654722 |
+---------+----------+-------------+------------+------------+
7 rows in set (0.00 sec)

//5. Change the quantity of a purchased product of inv_id ‘200’ 

mysql> UPDATE INVOICE_ITEM SET QUALITY=7 WHERE INV_ID=200;
Query OK, 1 row affected (0.00 sec)
Rows matched: 1  Changed: 1  Warnings: 0

mysql> SELECT * FROM INVOICE_ITEM;
+--------+------+---------+
| INV_ID | P_ID | QUALITY |
+--------+------+---------+
|    202 |  102 |       2 |
|    203 |  102 |       5 |
|    204 |  103 |       1 |
|    205 |  104 |       3 |
|    206 |  103 |       1 |
|    207 |  102 |       4 |
|    208 |  105 |       7 |
|    209 |  102 |       4 |
|    210 |  107 |       2 |
|    211 |  106 |       2 |
|    212 |  107 |       6 |
|    201 |  107 |       2 |
|    201 |  106 |       5 |
|    202 |  102 |       1 |
|    202 |  104 |       2 |
|    201 |  103 |       2 |
|    202 |  106 |       4 |
|    200 |  102 |       7 |
+--------+------+---------+
18 rows in set (0.01 sec)

c) DML - DELETE 

//1. Delete the record of customer id ‘3’.

mysql>DELETE FROM INVOICE_ITEM WHERE INV_ID = 204 OR INV_ID = 206;
Query OK, 2 rows affected (0.00 sec)

mysql> DELETE FROM INVOICE_MASTER WHERE CUST_ID =3;
Query OK, 2 rows affected (0.00 sec)

mysql> DELETE FROM CUSTOMER WHERE CUST_ID =3;
Query OK, 1 row affected (0.00 sec)

mysql> SELECT * FROM CUSTOMER WHERE CUST_ID=3;
Empty set (0.00 sec)

// 2. Delete all purchase details of items its quantity less than 2. 


mysql> DELETE FROM INVOICE_ITEM WHERE QUALITY<2;
Query OK, 1 row affected (0.00 sec)

mysql> SELECT * FROM INVOICE_ITEM WHERE QUALITY<2;
Empty set (0.00 sec)

// 3. Delete the purchase details of product ‘pen’ in the in_id ‘212’. 


mysql> DELETE FROM INVOICE_ITEM WHERE INV_ID=212 AND P_ID=107;
Query OK, 1 row affected (0.01 sec)

mysql> SELECT * FROM INVOICE_ITEM WHERE INV_ID=212 AND P_ID=107;
Empty set (0.00 sec)

// 4. Delete details of customer who does not have phone number. 

mysql> DELETE FROM INVOICE_ITEM WHERE INV_ID=200 or INV_ID=201 OR INV_ID=202 OR INV_ID=203 OR INV_ID=212;
Query OK, 0 rows affected (0.00 sec)

mysql> DELETE  FROM INVOICE_MASTER WHERE CUST_ID=1 and CUST_ID=2;
Query OK, 2 rows affected (0.00 sec)

mysql> DELETE FROM CUSTOMER WHERE PH_NO IS NULL ;
Query OK, 1 row affected (0.01 sec)

mysql> SELECT * FROM CUSTOMER;
+---------+---------+-------------+------------+------------+
| CUST_ID | NAME    | ADDRESS     | CITY       | PH_NO      |
+---------+---------+-------------+------------+------------+
|       1 | AMITHA  | NILAMBUR    | TVM        | 9207231471 |
|       4 | MANISHA | KOLAKKATTIL | TVM        | 9207231471 |
|       5 | SHAIKHA | NARIPOYIL   | MALAPPURAM | 9456574722 |
|       6 | NEFLA   | KOLAKKATTIL | WAYANAD    | 9207418571 |
|       7 | ANU     | KARULAYI    | MALAPPURAM | 9123654722 |
+---------+---------+-------------+------------+------------+
5 rows in set (0.00 sec)

// 5. Delete all records from STUDENT table. 

mysql> delete from student;
Query OK, 0 rows affected (0.00 sec)

mysql> select * from student;
Empty set (0.01 sec)

// 6. Delete Invoice details of a particular customer "MANISHA".

mysql> DELETE FROM INVOICE_ITEM WHERE INV_ID=205;
Query OK, 1 row affected (0.01 sec)

mysql> DELETE FROM INVOICE_MASTER WHERE CUST_ID=4;
Query OK, 1 row affected (0.00 sec)

mysql> DELETE FROM CUSTOMER WHERE NAME="MANISHA";
Query OK, 1 row affected (0.01 sec)

mysql> SELECT * FROM CUSTOMER;
+---------+---------+-------------+------------+------------+
| CUST_ID | NAME    | ADDRESS     | CITY       | PH_NO      |
+---------+---------+-------------+------------+------------+
|       1 | AMITHA  | NILAMBUR    | TVM        | 9207231471 |
|       5 | SHAIKHA | NARIPOYIL   | MALAPPURAM | 9456574722 |
|       6 | NEFLA   | KOLAKKATTIL | WAYANAD    | 9207418571 |
|       7 | ANU     | KARULAYI    | MALAPPURAM | 9123654722 |
+---------+---------+-------------+------------+------------+
4 rows in set (0.01 sec)

// 7. Delete the first two records of INVOICE_ITEM table its purchase quantity is high.

mysql> DELETE FROM INVOICE_ITEM LIMIT 2;
Query OK, 2 rows affected (0.01 sec)

mysql> select * from INVOICE_ITEM;
+--------+------+---------+
| INV_ID | P_ID | QUALITY |
+--------+------+---------+
|    201 |  107 |       2 |
|    201 |  106 |       5 |
|    201 |  103 |       2 |
+--------+------+---------+
3 rows in set (0.00 sec)


